{
  "schema_version": "0.1.0",
  "record_id": "pm_20260410_fxt001",
  "request_id": "pr_20260410_fxt001",
  "promoted_at": "2026-04-10T18:30:00Z",
  "promoter_name": "draft-promoter-stub",
  "promoter_version": "draft-promoter-stub-v0.1.0",
  "source_artifacts": [
    {
      "path": "generated/drafts/example-game/concept_packet.draft.json",
      "hash": "sha256:aaaaaaaaaaaaaaaaaaaaaaaaaaaaaaaaaaaaaaaaaaaaaaaaaaaaaaaaaaaaaaaa",
      "kind": "concept_packet_draft"
    },
    {
      "path": "generated/drafts/example-game/concept_packet.manifest.json",
      "hash": "sha256:bbbbbbbbbbbbbbbbbbbbbbbbbbbbbbbbbbbbbbbbbbbbbbbbbbbbbbbbbbbbbbbb",
      "kind": "generation_manifest"
    }
  ],
  "output_artifacts": [
    {
      "path": "generated/review/example-game/concept_packet.review.json",
      "hash": "sha256:cccccccccccccccccccccccccccccccccccccccccccccccccccccccccccccccc",
      "kind": "concept_packet_review"
    }
  ],
  "schema_versions_used": {
    "promotion_request_schema": "0.1.0",
    "promotion_record_schema": "0.1.0",
    "generation_manifest_schema": "0.1.0"
  },
  "status": "success",
  "notes": "Hand-authored happy-path fixture. Independent of the runtime promotion record under generated/review/. Hashes are placeholders. Matches runtime convention: the record does not self-reference in output_artifacts (it is the record of the run, not an output of it)."
}
