{
  "notes": null,
  "output_artifacts": [
    {
      "hash": "sha256:78aff8372cc45257d829240e57143a238100841eccd24b59ba2264576657dfd7",
      "kind": "concept_packet_review",
      "path": "generated/review/example-game/concept_packet.review.json"
    }
  ],
  "promoted_at": "2026-04-10T19:45:00Z",
  "promoter_name": "draft-promoter-stub",
  "promoter_version": "draft-promoter-stub-v0.1.0",
  "record_id": "pm_20260410_a1b2c3",
  "request_id": "pr_20260410_a1b2c3",
  "schema_version": "0.1.0",
  "schema_versions_used": {
    "generation_manifest_schema": "0.1.0",
    "promotion_record_schema": "0.1.0",
    "promotion_request_schema": "0.1.0"
  },
  "source_artifacts": [
    {
      "hash": "sha256:9a56dbd447b2989b4260d23c5bc89a99ffd4bcbfe3e9bea8cba0abcd764dbbef",
      "kind": "concept_packet_draft",
      "path": "generated/drafts/example-game/concept_packet.draft.json"
    },
    {
      "hash": "sha256:7de88db4a46584ebcc80d393625c7a19de3df5217a737572af5f6f2742a99ef8",
      "kind": "generation_manifest",
      "path": "generated/drafts/example-game/concept_packet.manifest.json"
    }
  ],
  "status": "success"
}
