{
  "notes": null,
  "output_artifacts": [
    {
      "hash": "sha256:4b8897e4ebbf56b6e13e81d7a953117b1740c097e9b36f5cb4f39dac18727009",
      "kind": "concept_packet_review",
      "path": "generated/review/snack-line-shuffle-mini/concept_packet.review.json"
    }
  ],
  "promoted_at": "2026-04-10T19:45:00Z",
  "promoter_name": "draft-promoter-stub",
  "promoter_version": "draft-promoter-stub-v0.1.0",
  "record_id": "pm_20260410_sls001",
  "request_id": "pr_20260410_sls001",
  "schema_version": "0.1.0",
  "schema_versions_used": {
    "generation_manifest_schema": "0.1.0",
    "promotion_record_schema": "0.1.0",
    "promotion_request_schema": "0.1.0"
  },
  "source_artifacts": [
    {
      "hash": "sha256:afc14744b0acffd503d5639114218dcd089608d08473d80d531c7dcf2ca1bb6d",
      "kind": "concept_packet_draft",
      "path": "generated/drafts/snack-line-shuffle-mini/concept_packet.draft.json"
    },
    {
      "hash": "sha256:255079bd4be6ad12db56addadc4bf4af23f50313f4acc00ef3e321702cf3f740",
      "kind": "generation_manifest",
      "path": "generated/drafts/snack-line-shuffle-mini/concept_packet.manifest.json"
    }
  ],
  "status": "success"
}
