{
  "notes": null,
  "output_artifacts": [
    {
      "hash": "sha256:4491b8ac86feecbeaff7674c75517ba5699d63408eefd3cd5eb4860c2ad304e0",
      "kind": "concept_packet_review",
      "path": "generated/review/bakery-rush-mini/concept_packet.review.json"
    }
  ],
  "promoted_at": "2026-04-10T18:30:00Z",
  "promoter_name": "draft-promoter-stub",
  "promoter_version": "draft-promoter-stub-v0.1.0",
  "record_id": "pm_20260410_brm001",
  "request_id": "pr_20260410_brm001",
  "schema_version": "0.1.0",
  "schema_versions_used": {
    "generation_manifest_schema": "0.1.0",
    "promotion_record_schema": "0.1.0",
    "promotion_request_schema": "0.1.0"
  },
  "source_artifacts": [
    {
      "hash": "sha256:a423a06f151ea48c3ec1baa701de389bc10dc4358c8d627e148d60f7d5b52558",
      "kind": "concept_packet_draft",
      "path": "generated/drafts/bakery-rush-mini/concept_packet.draft.json"
    },
    {
      "hash": "sha256:bad5ac28f47a4bd61f3c3b73eac917d65ae2adef55d6e520b4ae560a7900a6fb",
      "kind": "generation_manifest",
      "path": "generated/drafts/bakery-rush-mini/concept_packet.manifest.json"
    }
  ],
  "status": "success"
}
